{
  "api_version": "agent-platform/v1alpha1",
  "kind": "Event",
  "metadata": {
    "id": "evt_0198f6d0-7ef0-7b0e-a0d3-5f9c96c7f411",
    "revision": 1,
    "scope": {
      "type": "project",
      "tenant_id": "ten_0198f6d0-7ef0-7b0e-a0d3-5f9c96c7f411",
      "user_id": "usr_0198f6d0-7ef0-7b0e-a0d3-5f9c96c7f411",
      "project_id": "prj_0198f6d0-7ef0-7b0e-a0d3-5f9c96c7f411"
    },
    "labels": {},
    "annotations": {},
    "created_at": "2026-09-01T12:00:00Z",
    "created_by": {
      "actor_type": "system",
      "actor_id": "sys_scheduler"
    }
  },
  "spec": {
    "specversion": "1.0",
    "id": "evt_0198f6d0-7ef0-7b0e-a0d3-5f9c96c7f411",
    "source": "agent-runtime",
    "type": "task.created",
    "subject": "Task tsk_0198f6d0 created",
    "time": "2026-09-01T12:00:00Z",
    "datacontenttype": "application/json",
    "dataschema": "https://agent-platform.io/schemas/events/task.created/v1.0.0",
    "subject_ref": {
      "kind": "Task",
      "id": "tsk_0198f6d0-7ef0-7b0e-a0d3-5f9c96c7f411"
    },
    "sequence": 1,
    "trace": {
      "trace_id": "0198f6d07ef07b0ea0d35f9c96c7f411",
      "span_id": "0198f6d07ef07b0e",
      "correlation_id": "corr_0198f6d0-7ef0-7b0e-a0d3-5f9c96c7f411"
    },
    "schema_ref": {
      "id": "sch_event_task_created",
      "version": "1.0.0",
      "digest": "sha256:a1b2c3d4e5f6a1b2c3d4e5f6a1b2c3d4e5f6a1b2c3d4e5f6a1b2c3d4e5f6a1b2"
    },
    "data": {
      "task_id": "tsk_0198f6d0-7ef0-7b0e-a0d3-5f9c96c7f411",
      "title": "为项目增加用户设置页面",
      "intent": "development.implement_feature",
      "domain": "development",
      "requested_by": "usr_0198f6d0-7ef0-7b0e-a0d3-5f9c96c7f411",
      "source_type": "openclaw",
      "priority": 50
    }
  },
  "status": {
    "phase": "recorded"
  }
}
